{
  "$schema": "https://json-schema.org/draft/2020-12/schema",
  "$id": "urn:intdata:schema:installation-manifest:v1",
  "title": "InstallationManifestV1",
  "type": "object",
  "additionalProperties": false,
  "required": [
    "schema_version",
    "installation_id",
    "revision",
    "created_at",
    "origins",
    "modules",
    "capabilities",
    "policies",
    "configuration_custody",
    "resolver_preferences"
  ],
  "properties": {
    "schema_version": { "const": "InstallationManifestV1" },
    "installation_id": { "$ref": "#/$defs/identifier" },
    "revision": { "$ref": "#/$defs/positive_safe_integer" },
    "created_at": { "$ref": "#/$defs/timestamp" },
    "origins": {
      "type": "array",
      "minItems": 1,
      "maxItems": 64,
      "items": { "$ref": "#/$defs/origin" }
    },
    "modules": {
      "type": "array",
      "maxItems": 256,
      "items": { "$ref": "#/$defs/module_desire" }
    },
    "capabilities": {
      "type": "array",
      "maxItems": 256,
      "items": { "$ref": "#/$defs/capability_desire" }
    },
    "policies": {
      "type": "array",
      "maxItems": 128,
      "items": { "$ref": "#/$defs/policy_ref" }
    },
    "configuration_custody": {
      "type": "array",
      "maxItems": 256,
      "items": { "$ref": "#/$defs/custody_ref" }
    },
    "resolver_preferences": {
      "type": "object",
      "additionalProperties": false,
      "required": ["allow_prerelease", "preferred_modules"],
      "properties": {
        "allow_prerelease": { "type": "boolean" },
        "preferred_modules": {
          "type": "array",
          "maxItems": 128,
          "uniqueItems": true,
          "items": { "$ref": "#/$defs/identifier" }
        }
      }
    }
  },
  "$defs": {
    "identifier": {
      "type": "string",
      "minLength": 1,
      "maxLength": 128,
      "pattern": "^[a-z][a-z0-9]*(?:[._:-][a-z0-9]+)*$"
    },
    "sha256": { "type": "string", "pattern": "^[a-f0-9]{64}$" },
    "positive_safe_integer": { "type": "integer", "minimum": 1, "maximum": 9007199254740991 },
    "timestamp": {
      "type": "string",
      "format": "date-time",
      "pattern": "^\\d{4}-\\d{2}-\\d{2}T\\d{2}:\\d{2}:\\d{2}Z$"
    },
    "origin": {
      "type": "object",
      "additionalProperties": false,
      "required": ["origin_id", "url"],
      "properties": {
        "origin_id": { "$ref": "#/$defs/identifier" },
        "url": { "type": "string", "format": "uri", "pattern": "^https://[^/]+$" }
      }
    },
    "module_desire": {
      "type": "object",
      "additionalProperties": false,
      "required": ["module_id", "version_constraint", "state"],
      "properties": {
        "module_id": { "$ref": "#/$defs/identifier" },
        "version_constraint": { "type": "string", "minLength": 1, "maxLength": 128 },
        "state": { "enum": ["enabled", "disabled"] }
      }
    },
    "capability_desire": {
      "type": "object",
      "additionalProperties": false,
      "required": ["capability_id", "version_constraint"],
      "properties": {
        "capability_id": { "$ref": "#/$defs/identifier" },
        "version_constraint": { "type": "string", "minLength": 1, "maxLength": 128 }
      }
    },
    "policy_ref": {
      "type": "object",
      "additionalProperties": false,
      "required": ["policy_id", "version", "sha256"],
      "properties": {
        "policy_id": { "$ref": "#/$defs/identifier" },
        "version": { "type": "string", "minLength": 1, "maxLength": 64 },
        "sha256": { "$ref": "#/$defs/sha256" }
      }
    },
    "custody_ref": {
      "type": "object",
      "additionalProperties": false,
      "required": ["configuration_key", "custody_ref", "present"],
      "properties": {
        "configuration_key": { "$ref": "#/$defs/identifier" },
        "custody_ref": { "$ref": "#/$defs/identifier" },
        "present": { "type": "boolean" }
      }
    }
  }
}
